{
  "schema_version": "lean-julia-exact-fixture-v2",
  "fixture_id": "raw_compressed_value_equality",
  "theorem_family": "T1 raw/compressed value equality",
  "beliefs": ["only"],
  "transition_rows": [
    ["1//1"]
  ],
  "discount": "1//2",
  "modules": ["key"],
  "strategies": [
    {
      "id": "inactive",
      "operational_profile": ["0//1"],
      "modules": []
    },
    {
      "id": "bridge",
      "operational_profile": ["0//1"],
      "modules": ["key"]
    },
    {
      "id": "candidate",
      "operational_profile": ["2//1"],
      "modules": []
    }
  ],
  "libraries": [
    {
      "id": "base",
      "strategies": ["inactive", "bridge"]
    },
    {
      "id": "candidate_library",
      "strategies": ["inactive", "bridge", "candidate"]
    }
  ],
  "projects": [
    {
      "id": "innovate",
      "cost": ["0//1"],
      "duration": 1,
      "survival": "1//1",
      "strict_cost": false,
      "required_modules": ["key"],
      "candidate_strategies": ["candidate"]
    }
  ],
  "expected": {
    "rational_scalars": [
    {
      "id": "compressed_bellman_residual",
      "value": "0//1"
    },
    {
      "id": "compressed_infinite_value",
      "value": "4//3"
    },
    {
      "id": "raw_bellman_residual",
      "value": "0//1"
    },
    {
      "id": "raw_infinite_value",
      "value": "4//3"
    }
  ],
    "rational_vectors": [
    {
      "id": "compressed_finite_values_horizon_zero_to_five",
      "values": ["0//1", "0//1", "1//2", "7//8", "35//32", "155//128"]
    },
    {
      "id": "raw_finite_values_horizon_zero_to_five",
      "values": ["0//1", "0//1", "1//2", "7//8", "35//32", "155//128"]
    }
  ],
    "boolean_scalars": [
    {
      "id": "finite_values_equal",
      "value": true
    },
    {
      "id": "infinite_values_equal",
      "value": true
    },
    {
      "id": "stationary_actions_equal",
      "value": true
    }
  ],
    "boolean_vectors": [],
    "string_vectors": [
    {
      "id": "compressed_stationary_action",
      "values": ["research:innovate"]
    },
    {
      "id": "raw_stationary_action",
      "values": ["research:innovate"]
    }
  ]
  }
}
