{
  "schema_version": "lean-julia-exact-fixture-v2",
  "fixture_id": "multi_gap_disconnection",
  "theorem_family": "C2 multi-gap disconnection",
  "beliefs": ["b0", "b1", "b2", "b3", "b4"],
  "transition_rows": [
    ["1//1", "0//1", "0//1", "0//1", "0//1"],
    ["81//256", "27//64", "27//128", "3//64", "1//256"],
    ["1//16", "1//4", "3//8", "1//4", "1//16"],
    ["1//256", "3//64", "27//128", "27//64", "81//256"],
    ["0//1", "0//1", "0//1", "0//1", "1//1"]
  ],
  "discount": "1//1",
  "modules": ["marker"],
  "strategies": [
    {
      "id": "inactive",
      "operational_profile": ["0//1", "0//1", "0//1", "0//1", "0//1"],
      "modules": []
    },
    {
      "id": "left_candidate",
      "operational_profile": ["4//1", "0//1", "0//1", "0//1", "0//1"],
      "modules": ["marker"]
    },
    {
      "id": "right_candidate",
      "operational_profile": ["0//1", "0//1", "0//1", "0//1", "4//1"],
      "modules": ["marker"]
    }
  ],
  "libraries": [
    {
      "id": "current",
      "strategies": ["inactive"]
    }
  ],
  "projects": [
    {
      "id": "innovate",
      "cost": ["1//1", "1//1", "1//1", "1//1", "1//1"],
      "duration": 1,
      "survival": "1//1",
      "strict_cost": true,
      "required_modules": [],
      "candidate_strategies": ["left_candidate", "right_candidate"]
    }
  ],
  "expected": {
    "rational_scalars": [
    {
      "id": "connected_components",
      "value": "2//1"
    }
  ],
    "rational_vectors": [
    {
      "id": "aggregate_gap",
      "values": ["4//1", "0//1", "0//1", "0//1", "4//1"]
    },
    {
      "id": "coverage_potential",
      "values": ["4//1", "41//32", "1//2", "41//32", "4//1"]
    },
    {
      "id": "left_gap",
      "values": ["4//1", "0//1", "0//1", "0//1", "0//1"]
    },
    {
      "id": "right_gap",
      "values": ["0//1", "0//1", "0//1", "0//1", "4//1"]
    }
  ],
    "boolean_scalars": [
    {
      "id": "region_disconnected",
      "value": true
    }
  ],
    "boolean_vectors": [
    {
      "id": "research_region",
      "values": [true, true, false, true, true]
    }
  ],
    "string_vectors": []
  }
}
